{
  "id": "P02",
  "advocate": "E2E-mock-advocate-P02",
  "framing": "Mock framing for P02 — covers persona/surface verbatim from idea.spec.json.",
  "target_persona": "SaaS developer adding meeting intelligence",
  "primary_surface": "API Only",
  "opus_4_7_capability": "code-generation",
  "mvp_scope": "demo",
  "one_liner_pitch": "P02: deterministic e2e mock pitch.",
  "mockup_path": "mockups/P02-mock.html",
  "spec_alignment_notes": "all fields populated, followed spec verbatim — using react for the API Only stack"
}