{
  "advocate": "fixture-advocate",
  "framing": "Mock framing for spec-anchor-audit fixture, \u226520 chars.",
  "target_persona": "solo founder",
  "primary_surface": "Web PWA",
  "opus_4_7_capability": "code-generation",
  "mvp_scope": "demo",
  "one_liner_pitch": "Mock pitch.",
  "mockup_path": "mockups/P02-fixture.html",
  "spec_alignment_notes": "all fields populated, followed spec verbatim \u2014 using React for the Web PWA stack",
  "id": "P02"
}
