{
  "id": "P01",
  "advocate": "E2E-mock-advocate-P01",
  "framing": "Mock framing for P01 — covers persona/surface verbatim from idea.spec.json.",
  "target_persona": "1-3인 공방 운영자 (도예/가죽/플라워)",
  "primary_surface": "Web PWA",
  "opus_4_7_capability": "code-generation",
  "mvp_scope": "demo",
  "one_liner_pitch": "P01: deterministic e2e mock pitch.",
  "mockup_path": "mockups/P01-mock.html",
  "spec_alignment_notes": "all fields populated, followed spec verbatim — using react for the Web PWA stack"
}